{
  "overall": {
    "score": 52,
    "maxScore": 100,
    "percentage": 0.5226
  },
  "scorers": {
    "hardKeywords": {
      "score": 1,
      "maxScore": 2,
      "percentage": 0.5,
      "weight": 0.3,
      "weightedScore": 0.15,
      "details": {
        "score": 1,
        "maxScore": 2,
        "percentage": 0.5,
        "matched": [
          "Python"
        ],
        "missed": [
          "Amazon Web Services"
        ],
        "total": 2
      }
    },
    "softKeywords": {
      "score": 1,
      "maxScore": 1,
      "percentage": 1,
      "weight": 0.2,
      "weightedScore": 0.2,
      "details": {
        "score": 1,
        "maxScore": 1,
        "percentage": 1,
        "matched": [
          "Team Building"
        ],
        "missed": [],
        "total": 1
      }
    },
    "domainMatch": {
      "score": 1,
      "maxScore": 2,
      "percentage": 0.14285714285714285,
      "weight": 0.2,
      "weightedScore": 0.0286,
      "details": {
        "score": 1,
        "maxScore": 2,
        "percentage": 0.14285714285714285,
        "cvDomains": [
          "delivery-management",
          "backend-engineering",
          "automation",
          "devops",
          "leadership",
          "data-engineering"
        ],
        "jdDomains": [
          "backend-engineering",
          "cloud-infrastructure"
        ],
        "matched": [
          "backend-engineering"
        ],
        "missed": [
          "cloud-infrastructure"
        ],
        "total": 2
      }
    },
    "seniorityFit": {
      "score": 0.96,
      "maxScore": 1,
      "percentage": 0.96,
      "weight": 0.15,
      "weightedScore": 0.144,
      "details": {
        "score": 0.96,
        "maxScore": 1,
        "percentage": 0.96,
        "cvYears": 8.5,
        "jdYears": 5,
        "cvLevel": "senior",
        "jdLevel": "senior",
        "yearsFit": 1,
        "levelFit": 0.9
      }
    },
    "fuzzyMatch": {
      "score": 0,
      "maxScore": 7,
      "percentage": 0,
      "weight": 0.15,
      "weightedScore": 0,
      "details": {
        "score": 0,
        "maxScore": 7,
        "percentage": 0
      }
    }
  },
  "summary": {
    "strengths": [
      "Strong soft-skill alignment (100%)",
      "Seniority level aligns well with role"
    ],
    "gaps": [
      "Domain coverage gap (14%)",
      "Narrative language differs from JD"
    ],
    "keywordCoverage": {
      "matched": 2,
      "total": 3,
      "percentage": 0.67
    }
  },
  "recommendation": {
    "level": "gap",
    "label": "Weak match — significant gaps to address",
    "actions": [
      {
        "priority": "high",
        "action": "Improve semantic alignment: the CV's narrative language differs from the JD. Rewrite the professional summary and competency bullets using the JD's exact terminology and phrasing.",
        "impact": "high"
      },
      {
        "priority": "high",
        "action": "Bridge domain gaps: cloud-infrastructure. Reframe existing achievements to show experience in these areas, or identify adjacent experience that transfers.",
        "impact": "high"
      },
      {
        "priority": "medium",
        "action": "Add missing technical keywords to CV: Amazon Web Services. Weave these into achievements and skills sections.",
        "impact": "medium"
      }
    ]
  },
  "metadata": {
    "matchedAt": "2026-06-30T02:55:23.069Z",
    "matcherVersion": "1.0.0",
    "weightsUsed": {
      "hardKeywords": 0.3,
      "softKeywords": 0.2,
      "domainMatch": 0.2,
      "seniorityFit": 0.15,
      "fuzzyMatch": 0.15
    },
    "processingTimeMs": 2
  }
}